<?xml version="1.0" encoding="utf-8" ?>
<Persons xmlns="http://jd02_09.poprugo.it.by"
         xmlns:xsi="http://www.w3.org/2001/XMLSchema-instance"
         xsi:schemaLocation="http://jd02_09.poprugo.it.by Person.xsd"
>
    <Person>
        <Email>test123@mail.ru</Email>
        <Nikname>Test123</Nikname>
        <Password>qwerty</Password>
        <Ads>
            <Ad>
                <Description>Квартира в центре</Description>
                <Adress>Минск, ул Сурганова, 62</Adress>
                <Floor>2</Floor>
                <Floors>9</Floors>
                <Square>55.5</Square>
                <Price>80000</Price> <!-- <Price currancy="$">80000</Price> -->
            </Ad>
            <!-- <Ad>
                <Description>Квартира в центре</Description>
                <Adress>Минск, ул Коласа, 8</Adress>
                <Floor>5</Floor>
                <Floors>5</Floors>
                <Square>63</Square>
                <Price>125000</Price> //<Price currancy="$">125000</Price> //
            </Ad>-->
        </Ads>
    </Person>

    <Person>
        <Email>test123@mail.ru</Email>
        <Nikname>Test123</Nikname>
        <Password>qwerty</Password>
        <Ads>
            <Ad>
                <Description>Квартира в центре</Description>
                <Adress>Пинск, ул Ленина, 80</Adress>
                <Floor>3</Floor>
                <Floors>5</Floors>
                <Square>53.0</Square>
                <Price>62000</Price> <!-- <Price currancy="$">62000</Price> -->
            </Ad>
        </Ads>
    </Person>

</Persons>